timestamp,store,ons_item_no,ons_item_name,product_type,search_string,product_name,item_price_str,item_price_num,volume_price,unit_price,no_units,units,std_price,std_unit,promo,offer,ml_prediction,single_class
2016-10-03 09:36:20.963020,TESCO,211814,"Yoghurt, small individual",Kids Yoghurt,yogurt single,FRUBES VARIETY PACK 9 X 40G,£2.00,2.0,(£0.56/100g),0.56,100,g,5.6,kg,All products available for this offer,Any 2 for £3.00,1,1
2016-10-03 09:36:20.965532,TESCO,211814,"Yoghurt, small individual",Kids Yoghurt,yogurt single,WILDLIFE CHOOBS MIXED FRUIT 6X40G,£1.00,1.0,(£0.42/100g),0.42,100,g,4.2,kg,,,1,1
2016-10-03 09:36:20.967420,TESCO,211814,"Yoghurt, small individual",Kids Yoghurt,yogurt single,TESCO EVERYDAY VALUE FROMAGE FRAIS STRAWBERRY A...,£0.42,0.42,(£0.13/100g),0.13,100,g,1.3,kg,,,1,1
2016-10-03 09:36:20.969300,TESCO,211814,"Yoghurt, small individual",Kids Yoghurt,yogurt single,PETITS FILOUS STRAWBERRY & RASPBERRY FROMAGE FR...,£1.50,1.5,(£0.44/100g),0.44,100,g,4.4,kg,All products available for this offer,Any 2 for £2.00,1,1
2016-10-03 09:36:20.971254,TESCO,211814,"Yoghurt, small individual",Kids Yoghurt,yogurt single,MUNCH BUNCH DOUBLE UP STRAWBERRY AND VANILLA YO...,£1.50,1.5,(£0.44/100g),0.44,100,g,4.4,kg,All products available for this offer,Any 2 for £2.00,1,1
2016-10-03 09:36:20.973215,TESCO,211814,"Yoghurt, small individual",Kids Yoghurt,yogurt single,FRUBES STRAWBERRY 9 X 40G,£2.00,2.0,(£0.56/100g),0.56,100,g,5.6,kg,All products available for this offer,Any 2 for £3.00,1,1
2016-10-03 09:36:20.975184,TESCO,211814,"Yoghurt, small individual",Kids Yoghurt,yogurt single,PETITS FILOUS STRAWBERRY & RASPBERRY FROMAGE FR...,£1.50,1.5,(£0.53/100g),0.53,100,g,5.3,kg,All products available for this offer,Any 2 for £2.00,1,1
2016-10-03 09:36:20.977075,TESCO,211814,"Yoghurt, small individual",Kids Yoghurt,yogurt single,TESCO GOODNESS POUCHES STRAWBERRY AND RASPBERRY...,£1.00,1.0,(£0.31/100g),0.31,100,g,3.1,kg,,,1,1
2016-10-03 09:36:20.979001,TESCO,211814,"Yoghurt, small individual",Kids Yoghurt,yogurt single,PETITS FILOUS STRAWBERRY AND APRICOT FROMAGE FR...,£1.50,1.5,(£0.53/100g),0.53,100,g,5.3,kg,All products available for this offer,Any 2 for £2.00,1,1
2016-10-03 09:36:20.980907,TESCO,211814,"Yoghurt, small individual",Kids Yoghurt,yogurt single,WILDLIFE CHOOBS STRAWBERRY 6X40G,£1.00,1.0,(£0.42/100g),0.42,100,g,4.2,kg,,,1,1
2016-10-03 09:36:20.982818,TESCO,211814,"Yoghurt, small individual",Kids Yoghurt,yogurt single,PETITS FILOUS APRICOT AND STRAWBERRY FROMAGE FR...,£1.50,1.5,(£0.44/100g),0.44,100,g,4.4,kg,All products available for this offer,Any 2 for £2.00,1,1
2016-10-03 09:36:20.984758,TESCO,211814,"Yoghurt, small individual",Kids Yoghurt,yogurt single,PEPPA PIG STRAWBERRY FROMAGE FRAIS 6X45G,£1.00,1.0,(£0.37/100g),0.37,100,g,3.7,kg,,,1,1
2016-10-03 09:36:20.986655,TESCO,211814,"Yoghurt, small individual",Kids Yoghurt,yogurt single,MUNCH BUNCH FRUIT FROMAGE FRAIS 6X42G,£1.25,1.25,(£0.50/100g),0.5,100,g,5.0,kg,All products available for this offer,Any 2 for £2.00,1,1
2016-10-03 09:36:20.988565,TESCO,211814,"Yoghurt, small individual",Kids Yoghurt,yogurt single,FRUBES LIMITED EDITION BANANA AND STRAWBERRY 9 ...,£2.00,2.0,(£0.56/100g),0.56,100,g,5.6,kg,All products available for this offer,Any 2 for £3.00,1,1
2016-10-03 09:36:20.990518,TESCO,211814,"Yoghurt, small individual",Kids Yoghurt,yogurt single,PETITS FILOUS FROMAGE FRAIS 18X47G,£3.00,3.0,(£0.36/100g),0.36,100,g,3.6,kg,,,1,1
2016-10-03 09:36:20.992356,TESCO,211814,"Yoghurt, small individual",Kids Yoghurt,yogurt single,FRUBES POUCHES STRAWBERRY AND RASPBERRY 6X70G,£2.00,2.0,(£0.48/100g),0.48,100,g,4.8,kg,All products available for this offer,Any 2 for £3.00,1,1
2016-10-03 09:36:20.994298,TESCO,211814,"Yoghurt, small individual",Kids Yoghurt,yogurt single,MUNCH BUNCH SQUASHUM STRAWBERRY AND RASPBERRY 6...,£2.00,2.0,(£0.56/100g),0.56,100,g,5.6,kg,All products available for this offer,Any 2 for £3.00,1,1
2016-10-03 09:36:20.996279,TESCO,211814,"Yoghurt, small individual",Kids Yoghurt,yogurt single,LITTLE YEOS FROMAGE FRAIS STRAWBERRY RASPBERRY ...,£1.50,1.5,(£0.56/100g),0.56,100,g,5.6,kg,All products available for this offer,Any 2 for £2.00,1,1
2016-10-03 09:36:20.998226,TESCO,211814,"Yoghurt, small individual",Kids Yoghurt,yogurt single,LITTLE YEOS FROMAGE FRAIS RASPBERRY APRICOT 6 P...,£1.50,1.5,(£0.56/100g),0.56,100,g,5.6,kg,All products available for this offer,Any 2 for £2.00,1,1
2016-10-03 09:36:21.000183,TESCO,211814,"Yoghurt, small individual",Kids Yoghurt,yogurt single,DANONE ACTIMEL FOR KIDS RASPBERRY STRAWBERRY 6X...,£2.00,2.0,(£0.33/100g),0.33,100,g,3.3,kg,,,1,1
2016-10-03 09:36:21.174998,TESCO,211814,"Yoghurt, small individual",Corner Yoghurt,yogurt single,MULLER CORNER CRUNCH YOGHURT 6X135G,£2.00,2.0,(£0.25/100g),0.25,100,g,2.5,kg,Save £1.00 Was £3.00 Now £2.00 - all products for this offer,Save £1.00 Was £3.00 Now £2.00,1,1
2016-10-03 09:36:21.177051,TESCO,211814,"Yoghurt, small individual",Corner Yoghurt,yogurt single,MULLER CORNER BISCUIT YOGHURT 6X135,£2.00,2.0,(£0.25/100g),0.25,100,g,2.5,kg,Save £1.00 Was £3.00 Now £2.00 - all products for this offer,Save £1.00 Was £3.00 Now £2.00,1,1
2016-10-03 09:36:21.180199,TESCO,211814,"Yoghurt, small individual",Corner Yoghurt,yogurt single,MULLER CORNER FRUIT YOGHURT 6X150G,£2.00,2.0,(£0.22/100g),0.22,100,g,2.2,kg,Save £1.00 Was £3.00 Now £2.00 - all products for this offer,Save £1.00 Was £3.00 Now £2.00,1,1
2016-10-03 09:36:21.182585,TESCO,211814,"Yoghurt, small individual",Corner Yoghurt,yogurt single,MULLER CORNER FRUIT STRAWBERRY YOGHURT 150G,£0.55,0.55,(£0.37/100g),0.37,100,g,3.7,kg,All products available for this offer,Any 6 for £3.00,1,1
2016-10-03 09:36:21.184860,TESCO,211814,"Yoghurt, small individual",Corner Yoghurt,yogurt single,MULLER CORNER CRUNCH VANILLA CHOCOLATE BALLS YO...,£0.55,0.55,(£0.41/100g),0.41,100,g,4.1,kg,All products available for this offer,Any 6 for £3.00,1,1
2016-10-03 09:36:21.186891,TESCO,211814,"Yoghurt, small individual",Corner Yoghurt,yogurt single,MULLER CORNER CRUNCH CHOCOLATE DIGESTIVE YOGHUR...,£0.55,0.55,(£0.41/100g),0.41,100,g,4.1,kg,All products available for this offer,Any 6 for £3.00,1,1
2016-10-03 09:36:21.188818,TESCO,211814,"Yoghurt, small individual",Corner Yoghurt,yogurt single,MULLER CORNER CRUNCH BANANA CHOCOLATE FLAKES 13...,£0.55,0.55,(£0.41/100g),0.41,100,g,4.1,kg,All products available for this offer,Any 6 for £3.00,1,1
2016-10-03 09:36:21.190787,TESCO,211814,"Yoghurt, small individual",Corner Yoghurt,yogurt single,MULLER CORNER CRUNCH TOFFEE HOOPS YOGHURT 135G,£0.55,0.55,(£0.41/100g),0.41,100,g,4.1,kg,All products available for this offer,Any 6 for £3.00,1,1
2016-10-03 09:36:21.192709,TESCO,211814,"Yoghurt, small individual",Corner Yoghurt,yogurt single,MULLER CORNER CRUNCH STRAWBERRY SHORTCAKES YOGH...,£0.55,0.55,(£0.41/100g),0.41,100,g,4.1,kg,All products available for this offer,Any 6 for £3.00,1,1
2016-10-03 09:36:21.194643,TESCO,211814,"Yoghurt, small individual",Corner Yoghurt,yogurt single,MULLER CORNER FRUIT CHERRY YOGHURT 150G,£0.55,0.55,(£0.37/100g),0.37,100,g,3.7,kg,All products available for this offer,Any 6 for £3.00,1,1
2016-10-03 09:36:21.196543,TESCO,211814,"Yoghurt, small individual",Corner Yoghurt,yogurt single,MULLER CORNER FRUIT PEACH AND APRICOT YOGHURT 1...,£0.55,0.55,(£0.37/100g),0.37,100,g,3.7,kg,All products available for this offer,Any 6 for £3.00,1,1
2016-10-03 09:36:21.198502,TESCO,211814,"Yoghurt, small individual",Corner Yoghurt,yogurt single,MULLER CORNER FRUIT BLACKBERRY AND RASPBERRY YO...,£0.55,0.55,(£0.37/100g),0.37,100,g,3.7,kg,All products available for this offer,Any 6 for £3.00,1,1
2016-10-03 09:36:21.200421,TESCO,211814,"Yoghurt, small individual",Corner Yoghurt,yogurt single,MULLER LIGHT GOODIES LEMON MERINGUE 4 PACK,£2.50,2.5,(£0.63/each),0.63,1.0,each,0.63,each,,,1,1
2016-10-03 09:36:21.202315,TESCO,211814,"Yoghurt, small individual",Corner Yoghurt,yogurt single,MULLER CORNER GREEK STYLE CHERRY YOGHURT 4X150G,£2.50,2.5,(£0.42/100g),0.42,100,g,4.2,kg,,,1,1
2016-10-03 09:36:21.204182,TESCO,211814,"Yoghurt, small individual",Corner Yoghurt,yogurt single,MULLER CORNER RED FRUIT YOGHURT 6 X 150G,£2.00,2.0,(£0.22/100g),0.22,100,g,2.2,kg,Save £1.00 Was £3.00 Now £2.00 - all products for this offer,Save £1.00 Was £3.00 Now £2.00,1,1
2016-10-03 09:36:21.206102,TESCO,211814,"Yoghurt, small individual",Corner Yoghurt,yogurt single,MULLER LIGHT GOODIES STRAWBERRY WHITE CHOCOLATE...,£2.50,2.5,(£0.63/each),0.63,1.0,each,0.63,each,,,1,1
2016-10-03 09:36:21.208106,TESCO,211814,"Yoghurt, small individual",Corner Yoghurt,yogurt single,MULLER CORNER BLISS LEMON 4X110G,£2.50,2.5,(£0.57/100g),0.57,100,g,5.7,kg,,,1,1
2016-10-03 09:36:21.209971,TESCO,211814,"Yoghurt, small individual",Corner Yoghurt,yogurt single,MULLER CORNER GREEK STRAWBERRY YOGHURT 4X150G,£2.50,2.5,(£0.42/100g),0.42,100,g,4.2,kg,,,1,1
2016-10-03 09:36:21.211852,TESCO,211814,"Yoghurt, small individual",Corner Yoghurt,yogurt single,MULLER CORNER BLISS STRAWBERRY 4X110G,£2.50,2.5,(£0.57/100g),0.57,100,g,5.7,kg,,,1,1
2016-10-03 09:36:21.213741,TESCO,211814,"Yoghurt, small individual",Corner Yoghurt,yogurt single,MULLER CORNER PUD. CHOCOLATE BALLS 4 X 85G,£1.50,1.5,(£0.44/100g),0.44,100,g,4.4,kg,Save 50p Was £2.00 Now £1.50 - all products for this offer,Save 50p Was £2.00 Now £1.50,1,1
2016-10-03 09:36:21.340450,TESCO,211807,Yoghurt/Fromage Frais ,Natural & Greek Yoghurt,fromage frais,TESCO GREEK STYLE YOGHURT 500G,£1.00,1.0,(£0.20/100g),0.2,100,g,2.0,kg,,,1,1
2016-10-03 09:36:21.342214,TESCO,211807,Yoghurt/Fromage Frais ,Natural & Greek Yoghurt,fromage frais,TESCO LOW FAT NATURAL YOGHURT 500G,£0.90,0.9,(£0.18/100g),0.18,100,g,1.8,kg,,,1,1
2016-10-03 09:36:21.344498,TESCO,211807,Yoghurt/Fromage Frais ,Natural & Greek Yoghurt,fromage frais,TOTAL 0% FAT GREEK YOGHURT 500G,£2.40,2.4,(£0.48/100g),0.48,100,g,4.8,kg,,,1,1
2016-10-03 09:36:21.346256,TESCO,211807,Yoghurt/Fromage Frais ,Natural & Greek Yoghurt,fromage frais,TESCO LOW FAT GREEK STYLE YOGHURT 500G,£1.00,1.0,(£0.20/100g),0.2,100,g,2.0,kg,,,1,1
2016-10-03 09:36:21.347957,TESCO,211807,Yoghurt/Fromage Frais ,Natural & Greek Yoghurt,fromage frais,FAGE TOTAL GREEK YOGHURT 500G,£2.40,2.4,(£0.48/100g),0.48,100,g,4.8,kg,,,1,1
2016-10-03 09:36:21.349637,TESCO,211807,Yoghurt/Fromage Frais ,Natural & Greek Yoghurt,fromage frais,TESCO HEALTHY LIVING NATURAL FROMAGE FRAIS 500G,£1.00,1.0,(£0.20/100g),0.2,100,g,2.0,kg,,,1,1
2016-10-03 09:36:21.351419,TESCO,211807,Yoghurt/Fromage Frais ,Natural & Greek Yoghurt,fromage frais,YEO VALLEY NATURAL YOGHURT 150G,£0.50,0.5,(£0.33/100g),0.33,100,g,3.3,kg,,,1,1
2016-10-03 09:36:21.353091,TESCO,211807,Yoghurt/Fromage Frais ,Natural & Greek Yoghurt,fromage frais,TESCO LOW FAT NATURAL YOGHURT 1KG,£1.70,1.7,(£0.17/100g),0.17,100,g,1.7,kg,,,1,1
2016-10-03 09:36:21.354878,TESCO,211807,Yoghurt/Fromage Frais ,Natural & Greek Yoghurt,fromage frais,MULLER LIGHT GREEK LUSCIOUS LEMON YOGHURT 4X120...,£1.25,1.25,(£0.26/100g),0.26,100,g,2.6,kg,Half Price Was £2.50 Now £1.25 - all products for this offer,Half Price Was £2.50 Now £1.25,1,1
2016-10-03 09:36:21.356632,TESCO,211807,Yoghurt/Fromage Frais ,Natural & Greek Yoghurt,fromage frais,DANONE OYKOS GREEK STYLE YOGHURT STRAWBERRY 440...,£2.00,2.0,(£0.46/100g),0.46,100,g,4.6,kg,,,1,1
2016-10-03 09:36:21.358339,TESCO,211807,Yoghurt/Fromage Frais ,Natural & Greek Yoghurt,fromage frais,TESCO EVERYDAY VALUE LOW FAT NATURAL YOGHURT 50...,£0.45,0.45,(£0.09/100g),0.09,100,g,0.9,kg,,,1,1
2016-10-03 09:36:21.360105,TESCO,211807,Yoghurt/Fromage Frais ,Natural & Greek Yoghurt,fromage frais,YEO VALLEY GREEK STYLE HONEY YOGHURT 4X100G,£1.75,1.75,(£0.44/100g),0.44,100,g,4.4,kg,,,1,1
2016-10-03 09:36:21.361808,TESCO,211807,Yoghurt/Fromage Frais ,Natural & Greek Yoghurt,fromage frais,TESCO GREEK STYLE YOGHURT 4 X 100G,£1.00,1.0,(£0.25/100g),0.25,100,g,2.5,kg,,,1,1
2016-10-03 09:36:21.363507,TESCO,211807,Yoghurt/Fromage Frais ,Natural & Greek Yoghurt,fromage frais,TOTAL 0% FAT GREEK YOGHURT 170G,£1.00,1.0,(£0.59/100g),0.59,100,g,5.9,kg,,,1,1
2016-10-03 09:36:21.365229,TESCO,211807,Yoghurt/Fromage Frais ,Natural & Greek Yoghurt,fromage frais,YEO VALLEY NATURAL YOGHURT 1KG,£2.50,2.5,(£0.25/100g),0.25,100,g,2.5,kg,,,1,1
2016-10-03 09:36:21.366973,TESCO,211807,Yoghurt/Fromage Frais ,Natural & Greek Yoghurt,fromage frais,ONKEN NATURAL SET YOGHURT 500G,£1.00,1.0,(£0.20/100g),0.2,100,g,2.0,kg,Save 20p Was £1.20 Now £1.00 - all products for this offer,Save 20p Was £1.20 Now £1.00,1,1
2016-10-03 09:36:21.368713,TESCO,211807,Yoghurt/Fromage Frais ,Natural & Greek Yoghurt,fromage frais,YEO VALLEY NATURAL YOGHURT 4X120G,£1.50,1.5,(£0.31/100g),0.31,100,g,3.1,kg,,,1,1
2016-10-03 09:36:21.370423,TESCO,211807,Yoghurt/Fromage Frais ,Natural & Greek Yoghurt,fromage frais,TESCO GREEK STYLE YOGHURT 200G,£0.50,0.5,(£0.25/100g),0.25,100,g,2.5,kg,,,1,1
2016-10-03 09:36:21.372475,TESCO,211807,Yoghurt/Fromage Frais ,Natural & Greek Yoghurt,fromage frais,MULLER CORNER GREEK STYLE CHERRY YOGHURT 4X150G,£2.50,2.5,(£0.42/100g),0.42,100,g,4.2,kg,,,1,1
2016-10-03 09:36:21.374159,TESCO,211807,Yoghurt/Fromage Frais ,Natural & Greek Yoghurt,fromage frais,DANONE OYKOS PEACH GREEK STYLE YOGHURT 4X110G,£2.00,2.0,(£0.46/100g),0.46,100,g,4.6,kg,,,1,1
2016-10-03 09:36:21.562484,TESCO,211814,"Yoghurt, small individual",Fat Free & Low Fat Yoghurt,yogurt single,TESCO LOW FAT NATURAL YOGHURT 500G,£0.90,0.9,(£0.18/100g),0.18,100,g,1.8,kg,,,1,1
2016-10-03 09:36:21.565281,TESCO,211814,"Yoghurt, small individual",Fat Free & Low Fat Yoghurt,yogurt single,MULLER LIGHT FRUITS YOGHURT 6X175G,£3.00,3.0,(£0.29/100g),0.29,100,g,2.9,kg,,,1,1
2016-10-03 09:36:21.567186,TESCO,211814,"Yoghurt, small individual",Fat Free & Low Fat Yoghurt,yogurt single,TESCO LOW FAT BERRY MEDLEY YOGHURT 6X125G,£1.00,1.0,(£0.13/100g),0.13,100,g,1.3,kg,,,1,1
2016-10-03 09:36:21.569024,TESCO,211814,"Yoghurt, small individual",Fat Free & Low Fat Yoghurt,yogurt single,MULLER LIGHT YELLOW FRUIT YOGHURT 6X175,£3.00,3.0,(£0.29/100g),0.29,100,g,2.9,kg,,,1,1
2016-10-03 09:36:21.571116,TESCO,211814,"Yoghurt, small individual",Fat Free & Low Fat Yoghurt,yogurt single,DANONE ACTIVIA STRAWBERRY YOGHURT 4X125G,£1.00,1.0,(£0.20/100g),0.2,100,g,2.0,kg,Half Price Was £2.00 Now £1.00 - all products for this offer,Half Price Was £2.00 Now £1.00,1,1
2016-10-03 09:36:21.573104,TESCO,211814,"Yoghurt, small individual",Fat Free & Low Fat Yoghurt,yogurt single,TESCO EVERYDAY VALUE LOW FAT FRUIT YOGHURT 4X12...,£0.40,0.4,(£0.08/100g),0.08,100,g,0.8,kg,,,1,1
2016-10-03 09:36:21.575022,TESCO,211814,"Yoghurt, small individual",Fat Free & Low Fat Yoghurt,yogurt single,DANONE ACTIVIA RHUBARB YOGHURT 4X125G,£1.00,1.0,(£0.20/100g),0.2,100,g,2.0,kg,Half Price Was £2.00 Now £1.00 - all products for this offer,Half Price Was £2.00 Now £1.00,1,1
2016-10-03 09:36:21.576967,TESCO,211814,"Yoghurt, small individual",Fat Free & Low Fat Yoghurt,yogurt single,MULLER LIGHT TOFFEE YOGHURT 175G,£0.55,0.55,(£0.31/100g),0.31,100,g,3.1,kg,All products available for this offer,Any 6 for £3.00,1,1
2016-10-03 09:36:21.578959,TESCO,211814,"Yoghurt, small individual",Fat Free & Low Fat Yoghurt,yogurt single,SKI SMOOTH STRAWBERRY & RASPBERRY YOGHURT 4X120...,£1.00,1.0,(£0.21/100g),0.21,100,g,2.1,kg,,,1,1
2016-10-03 09:36:21.580904,TESCO,211814,"Yoghurt, small individual",Fat Free & Low Fat Yoghurt,yogurt single,MULLER LIGHT STRAWBERRY YOGHURT 175G,£0.55,0.55,(£0.31/100g),0.31,100,g,3.1,kg,All products available for this offer,Any 6 for £3.00,1,1
2016-10-03 09:36:21.582911,TESCO,211814,"Yoghurt, small individual",Fat Free & Low Fat Yoghurt,yogurt single,MULLER LIGHT BANANA AND CUSTARD YOGHURT 175G,£0.55,0.55,(£0.31/100g),0.31,100,g,3.1,kg,All products available for this offer,Any 6 for £3.00,1,1
2016-10-03 09:36:21.584856,TESCO,211814,"Yoghurt, small individual",Fat Free & Low Fat Yoghurt,yogurt single,TESCO FAT FREE GREEK STYLE YOGHURT 500G,£1.00,1.0,(£0.20/100g),0.2,100,g,2.0,kg,,,1,1
2016-10-03 09:36:21.586851,TESCO,211814,"Yoghurt, small individual",Fat Free & Low Fat Yoghurt,yogurt single,TESCO 0% FAT NATURAL YOGHURT 500G,£0.90,0.9,(£0.18/100g),0.18,100,g,1.8,kg,,,1,1
2016-10-03 09:36:21.589157,TESCO,211814,"Yoghurt, small individual",Fat Free & Low Fat Yoghurt,yogurt single,TOTAL 0% FAT GREEK YOGHURT 500G,£2.40,2.4,(£0.48/100g),0.48,100,g,4.8,kg,,,1,1
2016-10-03 09:36:21.591125,TESCO,211814,"Yoghurt, small individual",Fat Free & Low Fat Yoghurt,yogurt single,MULLER LIGHT VANILLA AND CHOCOLATE YOGHURT 165G,£0.55,0.55,(£0.33/100g),0.33,100,g,3.3,kg,All products available for this offer,Any 6 for £3.00,1,1
2016-10-03 09:36:21.593066,TESCO,211814,"Yoghurt, small individual",Fat Free & Low Fat Yoghurt,yogurt single,MULLER LIGHT RASPBERRY CRANBERRY YOGHURT 175G,£0.55,0.55,(£0.31/100g),0.31,100,g,3.1,kg,All products available for this offer,Any 6 for £3.00,1,1
2016-10-03 09:36:21.595383,TESCO,211814,"Yoghurt, small individual",Fat Free & Low Fat Yoghurt,yogurt single,DANONE ACTIVIA 0% FAT PEACH YOGHURT 4X125G,£1.00,1.0,(£0.20/100g),0.2,100,g,2.0,kg,Half Price Was £2.00 Now £1.00 - all products for this offer,Half Price Was £2.00 Now £1.00,1,1
2016-10-03 09:36:21.597407,TESCO,211814,"Yoghurt, small individual",Fat Free & Low Fat Yoghurt,yogurt single,TESCO LOW FAT SUNSHINE FRUITS YOGHURTS 6X125G,£1.00,1.0,(£0.13/100g),0.13,100,g,1.3,kg,,,1,1
2016-10-03 09:36:21.599418,TESCO,211814,"Yoghurt, small individual",Fat Free & Low Fat Yoghurt,yogurt single,TESCO LOW FAT GREEK STYLE YOGHURT 500G,£1.00,1.0,(£0.20/100g),0.2,100,g,2.0,kg,,,1,1
2016-10-03 09:36:21.601352,TESCO,211814,"Yoghurt, small individual",Fat Free & Low Fat Yoghurt,yogurt single,MULLER LIGHT CHERRY YOGHURT 175G,£0.55,0.55,(£0.31/100g),0.31,100,g,3.1,kg,All products available for this offer,Any 6 for £3.00,1,1
2016-10-03 09:36:21.616829,TESCO,211814,"Yoghurt, small individual",Yoghurt Drinks,yogurt single,DANONE ACTIMEL STRAWBERRY DRINK 12X100G,£3.50,3.5,(£0.29/100g),0.29,100,g,2.9,kg,All products available for this offer,Any 2 for £6.00,1,1
2016-10-03 09:36:21.619362,TESCO,211814,"Yoghurt, small individual",Yoghurt Drinks,yogurt single,MUNCH BUNCH DRINKY STRAWBERRY 6X90G,£1.50,1.5,(£0.28/100g),0.28,100,g,2.8,kg,,,1,1
2016-10-03 09:36:21.621774,TESCO,211814,"Yoghurt, small individual",Yoghurt Drinks,yogurt single,TESCO STRAWBERRY YOGHURT DRINKS 6 X 100G,£1.20,1.2,(£0.20/100g),0.2,100,g,2.0,kg,,,1,1
2016-10-03 09:36:21.623662,TESCO,211814,"Yoghurt, small individual",Yoghurt Drinks,yogurt single,DANONE ACTIMEL FAT FREE STRAWBERRY DRINK 8X100G,£2.75,2.75,(£0.34/100g),0.34,100,g,3.4,kg,All products available for this offer,Any 2 for £4.00,1,1
2016-10-03 09:36:21.625567,TESCO,211814,"Yoghurt, small individual",Yoghurt Drinks,yogurt single,YAKULT FERMENTED MILK DRINK 7X65ML,£2.75,2.75,(£0.60/100ml),0.6,100,ml,6.0,l,,,1,1
2016-10-03 09:36:21.627520,TESCO,211814,"Yoghurt, small individual",Yoghurt Drinks,yogurt single,DANONE ACTIMEL FOR KIDS RASPBERRY STRAWBERRY 6X...,£2.00,2.0,(£0.33/100g),0.33,100,g,3.3,kg,,,1,1
2016-10-03 09:36:21.629383,TESCO,211814,"Yoghurt, small individual",Yoghurt Drinks,yogurt single,DANONE ACTIMEL MULTIFRUIT DRINK 12X100G,£3.50,3.5,(£0.29/100g),0.29,100,g,2.9,kg,All products available for this offer,Any 2 for £6.00,1,1
2016-10-03 09:36:21.631325,TESCO,211814,"Yoghurt, small individual",Yoghurt Drinks,yogurt single,BENECOL STRAWBERRY YOGHURT DRINK 6X67.5G,£3.75,3.75,(£0.93/100g),0.93,100,g,9.3,kg,All products available for this offer,Any 2 for £6.00,1,1
2016-10-03 09:36:21.633280,TESCO,211814,"Yoghurt, small individual",Yoghurt Drinks,yogurt single,YAKULT LIGHT MILK DRINK 7X65ML,£2.75,2.75,(£0.60/100ml),0.6,100,ml,6.0,l,,,1,1
2016-10-03 09:36:21.635260,TESCO,211814,"Yoghurt, small individual",Yoghurt Drinks,yogurt single,DANONE ACTIMEL STRAWBERRY DRINK 8X100G,£2.75,2.75,(£0.34/100g),0.34,100,g,3.4,kg,All products available for this offer,Any 2 for £4.00,1,1
2016-10-03 09:36:21.637164,TESCO,211814,"Yoghurt, small individual",Yoghurt Drinks,yogurt single,DANONE ACTIMEL MULTIFRUIT DRINK 8X100G,£2.75,2.75,(£0.34/100g),0.34,100,g,3.4,kg,All products available for this offer,Any 2 for £4.00,1,1
2016-10-03 09:36:21.639124,TESCO,211814,"Yoghurt, small individual",Yoghurt Drinks,yogurt single,TESCO PEACH AND APRICOT YOGHURT DRINKS 6 X 100G,£1.20,1.2,(£0.20/100g),0.2,100,g,2.0,kg,,,1,1
2016-10-03 09:36:21.640956,TESCO,211814,"Yoghurt, small individual",Yoghurt Drinks,yogurt single,YOP RASPBERRY YOGHURT DRINK 500G,£1.00,1.0,(£0.20/100g),0.2,100,g,2.0,kg,,,1,1
2016-10-03 09:36:21.642932,TESCO,211814,"Yoghurt, small individual",Yoghurt Drinks,yogurt single,DANONE ACTIMEL FAT FREE ORIGINAL DRINK 12X100G,£3.50,3.5,(£0.29/100g),0.29,100,g,2.9,kg,All products available for this offer,Any 2 for £6.00,1,1
2016-10-03 09:36:21.644869,TESCO,211814,"Yoghurt, small individual",Yoghurt Drinks,yogurt single,BENECOL LIGHT NATURAL YOGHURT DRINK 6 X 67.5G,£3.75,3.75,(£0.93/100g),0.93,100,g,9.3,kg,All products available for this offer,Any 2 for £6.00,1,1
2016-10-03 09:36:21.646833,TESCO,211814,"Yoghurt, small individual",Yoghurt Drinks,yogurt single,DANONE ACTIMEL STRAWBERRY BLUEBERRY DRINK 12X10...,£3.50,3.5,(£0.29/100g),0.29,100,g,2.9,kg,All products available for this offer,Any 2 for £6.00,1,1
2016-10-03 09:36:21.648723,TESCO,211814,"Yoghurt, small individual",Yoghurt Drinks,yogurt single,DANONE ACTIMEL FAT FREE ORIGINAL DRINK 8X100G,£2.75,2.75,(£0.34/100g),0.34,100,g,3.4,kg,All products available for this offer,Any 2 for £4.00,1,1
2016-10-03 09:36:21.650852,TESCO,211814,"Yoghurt, small individual",Yoghurt Drinks,yogurt single,TESCO CHOLESTEROL REDUCING BLUEBERRY YOGHURT DR...,£2.25,2.25,(£0.38/100g),0.38,100,g,3.8,kg,,,1,1
2016-10-03 09:36:21.652748,TESCO,211814,"Yoghurt, small individual",Yoghurt Drinks,yogurt single,FRUBES MINIONS DRINK STRAWBERRY 4 X 180G,£2.00,2.0,(£1.12/100g),1.12,100,g,11.2,kg,All products available for this offer,Any 2 for £3.00,1,1
2016-10-03 09:36:21.654721,TESCO,211814,"Yoghurt, small individual",Yoghurt Drinks,yogurt single,BENECOL BLUEBERRY YOGHURT DRINK 6X67.5G,£3.75,3.75,(£0.93/100g),0.93,100,g,9.3,kg,All products available for this offer,Any 2 for £6.00,1,1
2016-10-03 09:36:21.741873,TESCO,211814,"Yoghurt, small individual",Dairy Free & Goats Yoghurt,yogurt single,ALPRO BIG POT NATURAL YOGHURT ALTERNATIVE 500G,£1.50,1.5,(£0.30/100g),0.3,100,g,3.0,kg,,,1,1
2016-10-03 09:36:21.743843,TESCO,211814,"Yoghurt, small individual",Dairy Free & Goats Yoghurt,yogurt single,ALPRO BLACKBERRY AND RASPBERRY YOGHURT 4X125G,£1.80,1.8,(£0.36/100g),0.36,100,g,3.6,kg,All products available for this offer,Any 2 for £2.50,1,1
2016-10-03 09:36:21.745761,TESCO,211814,"Yoghurt, small individual",Dairy Free & Goats Yoghurt,yogurt single,ALPRO PEACH AND PINEAPPLE YOGHURT ALTERNATIVE 4...,£1.80,1.8,(£0.36/100g),0.36,100,g,3.6,kg,All products available for this offer,Any 2 for £2.50,1,1
2016-10-03 09:36:21.747827,TESCO,211814,"Yoghurt, small individual",Dairy Free & Goats Yoghurt,yogurt single,TESCO FREE FROM STRAWBERRY SOYA FROMAGE ALT4X90...,£1.50,1.5,(£0.42/100g),0.42,100,g,4.2,kg,,,1,1
2016-10-03 09:36:21.749705,TESCO,211814,"Yoghurt, small individual",Dairy Free & Goats Yoghurt,yogurt single,ALPRO BIG POT VANILLA YOGHURT ALTERNATIVE 500G,£1.50,1.5,(£0.30/100g),0.3,100,g,3.0,kg,,,1,1
2016-10-03 09:36:21.751667,TESCO,211814,"Yoghurt, small individual",Dairy Free & Goats Yoghurt,yogurt single,TESCO FREE FROM MANGO YOGHURT 4X100G,£1.25,1.25,(£0.31/100g),0.31,100,g,3.1,kg,,,1,1
2016-10-03 09:36:21.753557,TESCO,211814,"Yoghurt, small individual",Dairy Free & Goats Yoghurt,yogurt single,TESCO FREE FROM RASPBERRY PASSION FRUIT YOGHURT...,£1.25,1.25,(£0.31/100g),0.31,100,g,3.1,kg,,,1,1
2016-10-03 09:36:21.755536,TESCO,211814,"Yoghurt, small individual",Dairy Free & Goats Yoghurt,yogurt single,LACTOFREE STRAWBERRY & RASPBERRY YOGHURT 4X125G,£1.60,1.6,(£0.32/100g),0.32,100,g,3.2,kg,,,1,1
2016-10-03 09:36:21.757389,TESCO,211814,"Yoghurt, small individual",Dairy Free & Goats Yoghurt,yogurt single,ALPRO BIG POT COCONUT YOGHURT ALTERNATIVE 500G,£1.80,1.8,(£0.36/100g),0.36,100,g,3.6,kg,,,1,1
2016-10-03 09:36:21.759327,TESCO,211814,"Yoghurt, small individual",Dairy Free & Goats Yoghurt,yogurt single,ALPRO GO-ON MANGO 150G,£0.85,0.85,(£0.57/100g),0.57,100,g,5.7,kg,,,1,1
2016-10-03 09:36:21.761215,TESCO,211814,"Yoghurt, small individual",Dairy Free & Goats Yoghurt,yogurt single,ALPRO STRAWBERRY AND PEACH YOGHURT ALTERNATIVE ...,£1.80,1.8,(£0.36/100g),0.36,100,g,3.6,kg,All products available for this offer,Any 2 for £2.50,1,1
2016-10-03 09:36:21.763305,TESCO,211814,"Yoghurt, small individual",Dairy Free & Goats Yoghurt,yogurt single,ALPRO GO-ON BLACKCURRANT 150G,£0.85,0.85,(£0.57/100g),0.57,100,g,5.7,kg,,,1,1
2016-10-03 09:36:21.765174,TESCO,211814,"Yoghurt, small individual",Dairy Free & Goats Yoghurt,yogurt single,ALPRO GO-ON PASSION FRUIT 150G,£0.85,0.85,(£0.57/100g),0.57,100,g,5.7,kg,,,1,1
2016-10-03 09:36:21.767049,TESCO,211814,"Yoghurt, small individual",Dairy Free & Goats Yoghurt,yogurt single,ST HELENS FARM NATURAL GOATS MILK YOGHURT 450G,£2.30,2.3,(£0.51/100g),0.51,100,g,5.1,kg,,,1,1
2016-10-03 09:36:21.768881,TESCO,211814,"Yoghurt, small individual",Dairy Free & Goats Yoghurt,yogurt single,ALPRO BIG POT ALMOND YOGHURT ALTERNATIVE 500G,£1.80,1.8,(£0.36/100g),0.36,100,g,3.6,kg,,,1,1
2016-10-03 09:36:21.770797,TESCO,211814,"Yoghurt, small individual",Dairy Free & Goats Yoghurt,yogurt single,TESCO FREE FROM NATURAL YOGHURT 500G,£1.25,1.25,(£0.25/100g),0.25,100,g,2.5,kg,,,1,1
