timestamp,store,ons_item_no,ons_item_name,product_type,search_string,product_name,item_price_str,item_price_num,volume_price,unit_price,no_units,units,std_price,std_unit,promo,offer,ml_prediction,single_class
2016-10-19 13:10:00.920498,TESCO,211814,"Yoghurt, small individual",Indulgent Yoghurts & Dairy Desserts,yogurt single,AERO CHOCOLATE MOUSSE 4X 59G,£1.00,1.0,(£0.44/100g),0.44,100,g,4.4,kg,Save 40p Was £1.40 Now £1.00 - all products for this offer,Save 40p Was £1.40 Now £1.00,1,1
2016-10-19 13:10:00.932595,TESCO,211814,"Yoghurt, small individual",Indulgent Yoghurts & Dairy Desserts,yogurt single,TESCO MILK CHOCOLATE MOUSSE 6X60G,£0.90,0.9,(£0.25/100g),0.25,100,g,2.5,kg,,,1,1
2016-10-19 13:10:00.934711,TESCO,211814,"Yoghurt, small individual",Indulgent Yoghurts & Dairy Desserts,yogurt single,NESTLE ROLO DESSERT 2X70G,£1.30,1.3,(£0.93/100g),0.93,100,g,9.3,kg,,,1,1
2016-10-19 13:10:00.937579,TESCO,211814,"Yoghurt, small individual",Indulgent Yoghurts & Dairy Desserts,yogurt single,TESCO EVERYDAY VALUE CHOCOLATE MOUSSE 4X60G,£0.20,0.2,(£0.08/100g),0.08,100,g,0.8,kg,,,1,1
2016-10-19 13:10:00.939629,TESCO,211814,"Yoghurt, small individual",Indulgent Yoghurts & Dairy Desserts,yogurt single,NESTLE MILKYBAR DESSERT 2 X 70G,£1.30,1.3,(£0.93/100g),0.93,100,g,9.3,kg,,,1,1
2016-10-19 13:10:00.941674,TESCO,211814,"Yoghurt, small individual",Indulgent Yoghurts & Dairy Desserts,yogurt single,AERO CREATIONS CHOCOLATE MOUSSE 4X57G,£1.50,1.5,(£0.66/100g),0.66,100,g,6.6,kg,,,1,1
2016-10-19 13:10:00.944670,TESCO,211814,"Yoghurt, small individual",Indulgent Yoghurts & Dairy Desserts,yogurt single,MULLER RICE STRAWBERRY 180G,£0.55,0.55,(£0.31/100g),0.31,100,g,3.1,kg,All products available for this offer,Any 10 for £3.00,1,1
2016-10-19 13:10:00.946856,TESCO,211814,"Yoghurt, small individual",Indulgent Yoghurts & Dairy Desserts,yogurt single,AERO MINT CHOCOLATE MOUSSE 4X58G,£1.00,1.0,(£0.43/100g),0.43,100,g,4.3,kg,Save 40p Was £1.40 Now £1.00 - all products for this offer,Save 40p Was £1.40 Now £1.00,1,1
2016-10-19 13:10:00.948951,TESCO,211814,"Yoghurt, small individual",Indulgent Yoghurts & Dairy Desserts,yogurt single,CADBURY FLAKE TWINPOT 90G,£0.75,0.75,(£0.83/100g),0.83,100,g,8.3,kg,All products available for this offer,Any 6 for £4.00,1,1
2016-10-19 13:10:00.951055,TESCO,211814,"Yoghurt, small individual",Indulgent Yoghurts & Dairy Desserts,yogurt single,CADBURY MILK BUTTONS TWINPOT 90G,£0.75,0.75,(£0.83/100g),0.83,100,g,8.3,kg,All products available for this offer,Any 6 for £4.00,1,1
2016-10-19 13:10:00.953151,TESCO,211814,"Yoghurt, small individual",Indulgent Yoghurts & Dairy Desserts,yogurt single,CADBURY BUBBLES OF JOY CHOCOLATE MOUSSE 4X45G,£1.00,1.0,(£0.56/100g),0.56,100,g,5.6,kg,Save 50p Was £1.50 Now £1.00 - all products for this offer,Save 50p Was £1.50 Now £1.00,1,1
2016-10-19 13:10:00.963539,TESCO,211814,"Yoghurt, small individual",Kids Yoghurt,yogurt single,WILDLIFE CHOOBS MIXED FRUIT 6X40G,£1.00,1.0,(£0.42/100g),0.42,100,g,4.2,kg,,,1,1
2016-10-19 13:10:00.970329,TESCO,211814,"Yoghurt, small individual",Indulgent Yoghurts & Dairy Desserts,yogurt single,WEIGHT WATCHERS DESSERT STYLE YOGHURT 4X110G,£1.00,1.0,(£0.23/100g),0.23,100,g,2.3,kg,,,1,1
2016-10-19 13:10:00.972452,TESCO,211814,"Yoghurt, small individual",Indulgent Yoghurts & Dairy Desserts,yogurt single,MULLER RICE VANILLA CUSTARD 180G,£0.55,0.55,(£0.31/100g),0.31,100,g,3.1,kg,All products available for this offer,Any 10 for £3.00,1,1
2016-10-19 13:10:00.974604,TESCO,211814,"Yoghurt, small individual",Indulgent Yoghurts & Dairy Desserts,yogurt single,MULLER RICE ORIGINAL 180G,£0.55,0.55,(£0.31/100g),0.31,100,g,3.1,kg,All products available for this offer,Any 10 for £3.00,1,1
2016-10-19 13:10:00.976736,TESCO,211814,"Yoghurt, small individual",Indulgent Yoghurts & Dairy Desserts,yogurt single,ROLO MOUSSE 4X50G,£1.00,1.0,(£0.50/100g),0.5,100,g,5.0,kg,Save 40p Was £1.40 Now £1.00 - all products for this offer,Save 40p Was £1.40 Now £1.00,1,1
2016-10-19 13:10:00.979044,TESCO,211814,"Yoghurt, small individual",Indulgent Yoghurts & Dairy Desserts,yogurt single,DANONE ACTIVIA INTENSELY CREAMY STRAWBERRY 4X11...,£2.40,2.4,(£0.55/100g),0.55,100,g,5.5,kg,All products available for this offer,Any 2 for £4.00,1,1
2016-10-19 13:10:00.981808,TESCO,211814,"Yoghurt, small individual",Kids Yoghurt,yogurt single,FRUBES VARIETY PACK 9 X 40G,£2.00,2.0,(£0.56/100g),0.56,100,g,5.6,kg,,,1,1
2016-10-19 13:10:00.983967,TESCO,211814,"Yoghurt, small individual",Kids Yoghurt,yogurt single,TESCO EVERYDAY VALUE FROMAGE FRAIS STRAWBERRY A...,£0.42,0.42,(£0.13/100g),0.13,100,g,1.3,kg,,,1,1
2016-10-19 13:10:00.985978,TESCO,211814,"Yoghurt, small individual",Kids Yoghurt,yogurt single,PETITS FILOUS STRAWBERRY & RASPBERRY FROMAGE FR...,£1.50,1.5,(£0.44/100g),0.44,100,g,4.4,kg,All products available for this offer,Any 2 for £2.00,1,1
2016-10-19 13:10:00.988081,TESCO,211814,"Yoghurt, small individual",Kids Yoghurt,yogurt single,MUNCH BUNCH DOUBLE UP STRAWBERRY AND VANILLA YO...,£1.50,1.5,(£0.44/100g),0.44,100,g,4.4,kg,All products available for this offer,Any 2 for £2.00,1,1
2016-10-19 13:10:00.992960,TESCO,211814,"Yoghurt, small individual",Indulgent Yoghurts & Dairy Desserts,yogurt single,PETITS FILOUS LITTLE DESSERTS 6X55G,£1.50,1.5,(£0.46/100g),0.46,100,g,4.6,kg,All products available for this offer,Any 2 for £2.00,1,1
2016-10-19 13:10:00.995230,TESCO,211814,"Yoghurt, small individual",Indulgent Yoghurts & Dairy Desserts,yogurt single,MULLER RICE APPLE 180G,£0.55,0.55,(£0.31/100g),0.31,100,g,3.1,kg,All products available for this offer,Any 10 for £3.00,1,1
2016-10-19 13:10:00.997360,TESCO,211814,"Yoghurt, small individual",Indulgent Yoghurts & Dairy Desserts,yogurt single,TESCO STRAWBERRY MOUSSE 6X60 G,£0.90,0.9,(£0.25/100g),0.25,100,g,2.5,kg,,,1,1
2016-10-19 13:10:00.999675,TESCO,211814,"Yoghurt, small individual",Indulgent Yoghurts & Dairy Desserts,yogurt single,TESCO BRITISH SKIMMED MILK 2.272L/4 PINTS,£1.00,1.0,(£0.44/l),0.44,1.0,l,0.44,l,,,1,1
2016-10-19 13:10:01.001768,TESCO,211814,"Yoghurt, small individual",Indulgent Yoghurts & Dairy Desserts,yogurt single,TESCO BRAEBURN APPLES LOOSE,£0.32,0.32,(£2.00/kg),2.0,1.0,kg,2.0,kg,,,1,1
2016-10-19 13:10:01.003856,TESCO,211814,"Yoghurt, small individual",Kids Yoghurt,yogurt single,FRUBES STRAWBERRY 9 X 40G,£2.00,2.0,(£0.56/100g),0.56,100,g,5.6,kg,,,1,1
2016-10-19 13:10:01.005904,TESCO,211814,"Yoghurt, small individual",Kids Yoghurt,yogurt single,PETITS FILOUS STRAWBERRY & RASPBERRY FROMAGE FR...,£1.50,1.5,(£0.53/100g),0.53,100,g,5.3,kg,All products available for this offer,Any 2 for £2.00,1,1
2016-10-19 13:10:01.008118,TESCO,211814,"Yoghurt, small individual",Kids Yoghurt,yogurt single,TESCO GOODNESS POUCHES STRAWBERRY AND RASPBERRY...,£1.00,1.0,(£0.31/100g),0.31,100,g,3.1,kg,,,1,1
2016-10-19 13:10:01.010294,TESCO,211814,"Yoghurt, small individual",Kids Yoghurt,yogurt single,WILDLIFE CHOOBS STRAWBERRY 6X40G,£1.00,1.0,(£0.42/100g),0.42,100,g,4.2,kg,,,1,1
2016-10-19 13:10:01.012302,TESCO,211814,"Yoghurt, small individual",Kids Yoghurt,yogurt single,PETITS FILOUS STRAWBERRY AND APRICOT FROMAGE FR...,£1.50,1.5,(£0.53/100g),0.53,100,g,5.3,kg,All products available for this offer,Any 2 for £2.00,1,1
2016-10-19 13:10:01.023296,TESCO,211814,"Yoghurt, small individual",Corner Yoghurt,yogurt single,MULLER CORNER CRUNCH YOGHURT 6X135G,£3.00,3.0,(£0.37/100g),0.37,100,g,3.7,kg,,,1,1
2016-10-19 13:10:01.025423,TESCO,211814,"Yoghurt, small individual",Indulgent Yoghurts & Dairy Desserts,yogurt single,TESCO BRITISH SEMI SKIMMED MILK 2.272LTR 4 PINT...,£1.00,1.0,(£0.44/l),0.44,1.0,l,0.44,l,,,1,1
2016-10-19 13:10:01.027492,TESCO,211814,"Yoghurt, small individual",Indulgent Yoghurts & Dairy Desserts,yogurt single,TESCO WHOLE CUCUMBER EACH,£0.42,0.42,(£0.42/each),0.42,1.0,each,0.42,each,,,1,1
2016-10-19 13:10:01.029603,TESCO,211814,"Yoghurt, small individual",Indulgent Yoghurts & Dairy Desserts,yogurt single,TESCO BAKING POTATOES LOOSE,£0.30,0.3,(£1.00/kg),1.0,1.0,kg,1.0,kg,,,1,1
2016-10-19 13:10:01.031653,TESCO,211814,"Yoghurt, small individual",Indulgent Yoghurts & Dairy Desserts,yogurt single,TESCO MIXED PEPPERS 3 PACK,£0.85,0.85,(£0.28/each),0.28,1.0,each,0.28,each,,,1,1
2016-10-19 13:10:01.035451,TESCO,211814,"Yoghurt, small individual",Kids Yoghurt,yogurt single,PETITS FILOUS APRICOT AND STRAWBERRY FROMAGE FR...,£1.50,1.5,(£0.44/100g),0.44,100,g,4.4,kg,All products available for this offer,Any 2 for £2.00,1,1
2016-10-19 13:10:01.037763,TESCO,211814,"Yoghurt, small individual",Kids Yoghurt,yogurt single,PEPPA PIG STRAWBERRY FROMAGE FRAIS 6X45G,£1.00,1.0,(£0.37/100g),0.37,100,g,3.7,kg,,,1,1
2016-10-19 13:10:01.039858,TESCO,211814,"Yoghurt, small individual",Kids Yoghurt,yogurt single,MUNCH BUNCH FRUIT FROMAGE FRAIS 6X42G,£1.25,1.25,(£0.50/100g),0.5,100,g,5.0,kg,All products available for this offer,Any 2 for £2.00,1,1
2016-10-19 13:10:01.041925,TESCO,211814,"Yoghurt, small individual",Kids Yoghurt,yogurt single,MUNCH BUNCH SQUASHUM STRAWBERRY AND RASPBERRY 6...,£2.00,2.0,(£0.56/100g),0.56,100,g,5.6,kg,All products available for this offer,Any 2 for £3.00,1,1
2016-10-19 13:10:01.044035,TESCO,211814,"Yoghurt, small individual",Kids Yoghurt,yogurt single,PETITS FILOUS FROMAGE FRAIS 18X47G,£3.00,3.0,(£0.36/100g),0.36,100,g,3.6,kg,,,1,1
2016-10-19 13:10:01.046706,TESCO,211814,"Yoghurt, small individual",Corner Yoghurt,yogurt single,MULLER CORNER CRUNCH VANILLA CHOCOLATE BALLS YO...,£0.55,0.55,(£0.41/100g),0.41,100,g,4.1,kg,All products available for this offer,Any 10 for £3.00,1,1
2016-10-19 13:10:01.048892,TESCO,211814,"Yoghurt, small individual",Corner Yoghurt,yogurt single,MULLER CORNER FRUIT STRAWBERRY YOGHURT 150G,£0.55,0.55,(£0.37/100g),0.37,100,g,3.7,kg,All products available for this offer,Any 10 for £3.00,1,1
2016-10-19 13:10:01.051062,TESCO,211814,"Yoghurt, small individual",Corner Yoghurt,yogurt single,MULLER CORNER BISCUIT YOGHURT 6X135,£3.00,3.0,(£0.37/100g),0.37,100,g,3.7,kg,,,1,1
2016-10-19 13:10:01.053028,TESCO,211814,"Yoghurt, small individual",Corner Yoghurt,yogurt single,MULLER CORNER FRUIT YOGHURT 6X150G,£3.00,3.0,(£0.33/100g),0.33,100,g,3.3,kg,,,1,1
2016-10-19 13:10:01.055042,TESCO,211814,"Yoghurt, small individual",Corner Yoghurt,yogurt single,MULLER CORNER CRUNCH CHOCOLATE DIGESTIVE YOGHUR...,£0.55,0.55,(£0.41/100g),0.41,100,g,4.1,kg,All products available for this offer,Any 10 for £3.00,1,1
2016-10-19 13:10:01.058414,TESCO,211814,"Yoghurt, small individual",Kids Yoghurt,yogurt single,FRUBES POUCHES STRAWBERRY AND RASPBERRY 6X70G,£2.00,2.0,(£0.48/100g),0.48,100,g,4.8,kg,,,1,1
2016-10-19 13:10:01.060668,TESCO,211814,"Yoghurt, small individual",Kids Yoghurt,yogurt single,FRUBES LIMITED EDITION BANANA AND STRAWBERRY 9 ...,£2.00,2.0,(£0.56/100g),0.56,100,g,5.6,kg,,,1,1
2016-10-19 13:10:01.062752,TESCO,211814,"Yoghurt, small individual",Kids Yoghurt,yogurt single,LITTLE YEOS FROMAGE FRAIS STRAWBERRY RASPBERRY ...,£1.50,1.5,(£0.56/100g),0.56,100,g,5.6,kg,All products available for this offer,Any 2 for £2.00,1,1
2016-10-19 13:10:01.064829,TESCO,211814,"Yoghurt, small individual",Kids Yoghurt,yogurt single,DANONE ACTIMEL FOR KIDS RASPBERRY STRAWBERRY 6X...,£1.50,1.5,(£0.25/100g),0.25,100,g,2.5,kg,Save 50p Was £2.00 Now £1.50 - all products for this offer,Save 50p Was £2.00 Now £1.50,1,1
2016-10-19 13:10:01.066977,TESCO,211814,"Yoghurt, small individual",Kids Yoghurt,yogurt single,TESCO BRITISH SKIMMED MILK 2.272L/4 PINTS,£1.00,1.0,(£0.44/l),0.44,1.0,l,0.44,l,,,1,1
2016-10-19 13:10:01.068976,TESCO,211814,"Yoghurt, small individual",Corner Yoghurt,yogurt single,MULLER CORNER CRUNCH BANANA CHOCOLATE FLAKES 13...,£0.55,0.55,(£0.41/100g),0.41,100,g,4.1,kg,All products available for this offer,Any 10 for £3.00,1,1
2016-10-19 13:10:01.071279,TESCO,211814,"Yoghurt, small individual",Corner Yoghurt,yogurt single,MULLER CORNER CRUNCH TOFFEE HOOPS YOGHURT 135G,£0.55,0.55,(£0.41/100g),0.41,100,g,4.1,kg,All products available for this offer,Any 10 for £3.00,1,1
2016-10-19 13:10:01.073387,TESCO,211814,"Yoghurt, small individual",Corner Yoghurt,yogurt single,MULLER CORNER CRUNCH STRAWBERRY SHORTCAKES YOGH...,£0.55,0.55,(£0.41/100g),0.41,100,g,4.1,kg,All products available for this offer,Any 10 for £3.00,1,1
2016-10-19 13:10:01.075503,TESCO,211814,"Yoghurt, small individual",Corner Yoghurt,yogurt single,MULLER CORNER FRUIT CHERRY YOGHURT 150G,£0.55,0.55,(£0.37/100g),0.37,100,g,3.7,kg,All products available for this offer,Any 10 for £3.00,1,1
2016-10-19 13:10:01.077584,TESCO,211814,"Yoghurt, small individual",Corner Yoghurt,yogurt single,MULLER LIGHT GOODIES LEMON MERINGUE 4X107G,£1.00,1.0,(£0.94/100g),0.94,100,g,9.4,kg,Better Than Half Price Was £2.50 Now £1.00 - all products for this offer,Better Than Half Price Was £2.50 Now £1.00,1,1
2016-10-19 13:10:01.079805,TESCO,211814,"Yoghurt, small individual",Kids Yoghurt,yogurt single,TESCO RED SEEDLESS GRAPES 500G,£2.00,2.0,(£4.00/kg),4.0,1.0,kg,4.0,kg,,,1,1
2016-10-19 13:10:01.081931,TESCO,211814,"Yoghurt, small individual",Kids Yoghurt,yogurt single,TESCO GALA APPLES LOOSE,£0.32,0.32,(£2.00/kg),2.0,1.0,kg,2.0,kg,,,1,1
2016-10-19 13:10:01.083979,TESCO,211814,"Yoghurt, small individual",Kids Yoghurt,yogurt single,TESCO RED PEPPERS EACH,£0.50,0.5,(£0.50/each),0.5,1.0,each,0.5,each,,,1,1
2016-10-19 13:10:01.086005,TESCO,211814,"Yoghurt, small individual",Kids Yoghurt,yogurt single,TESCO WHOLE CUCUMBER EACH,£0.42,0.42,(£0.42/each),0.42,1.0,each,0.42,each,,,1,1
2016-10-19 13:10:01.088057,TESCO,211814,"Yoghurt, small individual",Kids Yoghurt,yogurt single,TESCO BANANAS LOOSE,£0.12,0.12,(£0.68/kg),0.68,1.0,kg,0.68,kg,,,1,1
2016-10-19 13:10:01.090121,TESCO,211814,"Yoghurt, small individual",Corner Yoghurt,yogurt single,MULLER CORNER FRUIT PEACH AND APRICOT YOGHURT 1...,£0.55,0.55,(£0.37/100g),0.37,100,g,3.7,kg,All products available for this offer,Any 10 for £3.00,1,1
2016-10-19 13:10:01.092344,TESCO,211814,"Yoghurt, small individual",Corner Yoghurt,yogurt single,MULLER CORNER FRUIT BLACKBERRY AND RASPBERRY YO...,£0.55,0.55,(£0.37/100g),0.37,100,g,3.7,kg,All products available for this offer,Any 10 for £3.00,1,1
2016-10-19 13:10:01.094433,TESCO,211814,"Yoghurt, small individual",Corner Yoghurt,yogurt single,MULLER CORNER GREEK STYLE CHERRY YOGHURT 4X150G,£1.25,1.25,(£0.21/100g),0.21,100,g,2.1,kg,Half Price Was £2.50 Now £1.25 - all products for this offer,Half Price Was £2.50 Now £1.25,1,1
2016-10-19 13:10:01.096556,TESCO,211814,"Yoghurt, small individual",Corner Yoghurt,yogurt single,MULLER LIGHT STRAWBERRY WHITE CHOCOLATE 4X107G,£1.00,1.0,(£0.94/100g),0.94,100,g,9.4,kg,Better Than Half Price Was £2.50 Now £1.00 - all products for this offer,Better Than Half Price Was £2.50 Now £1.00,1,1
2016-10-19 13:10:01.098732,TESCO,211814,"Yoghurt, small individual",Corner Yoghurt,yogurt single,MULLER CORNER BLISS LEMON 4X110G,£1.25,1.25,(£0.28/100g),0.28,100,g,2.8,kg,Half Price Was £2.50 Now £1.25 - all products for this offer,Half Price Was £2.50 Now £1.25,1,1
2016-10-19 13:10:01.103773,TESCO,211814,"Yoghurt, small individual",Corner Yoghurt,yogurt single,MULLER CORNER GREEK STRAWBERRY YOGHURT 4X150G,£1.25,1.25,(£0.21/100g),0.21,100,g,2.1,kg,Half Price Was £2.50 Now £1.25 - all products for this offer,Half Price Was £2.50 Now £1.25,1,1
2016-10-19 13:10:01.105938,TESCO,211814,"Yoghurt, small individual",Corner Yoghurt,yogurt single,MULLER CORNER BLISS STRAWBERRY 4X110G,£1.25,1.25,(£0.28/100g),0.28,100,g,2.8,kg,Half Price Was £2.50 Now £1.25 - all products for this offer,Half Price Was £2.50 Now £1.25,1,1
2016-10-19 13:10:01.108359,TESCO,211814,"Yoghurt, small individual",Corner Yoghurt,yogurt single,MULLER LIGHT GOODIES COCONUT 4X107G,£1.00,1.0,(£0.23/100g),0.23,100,g,2.3,kg,Better Than Half Price Was £2.50 Now £1.00 - all products for this offer,Better Than Half Price Was £2.50 Now £1.00,1,1
2016-10-19 13:10:01.110582,TESCO,211814,"Yoghurt, small individual",Corner Yoghurt,yogurt single,MULLER CORNER RED FRUIT YOGHURT 6 X 150G,£3.00,3.0,(£0.33/100g),0.33,100,g,3.3,kg,,,1,1
2016-10-19 13:10:01.112573,TESCO,211814,"Yoghurt, small individual",Corner Yoghurt,yogurt single,TESCO 2 BONELESS SALMON FILLETS 270G,£3.50,3.5,(£12.97/kg),12.97,1.0,kg,12.97,kg,,,1,1
2016-10-19 13:10:01.114705,TESCO,211814,"Yoghurt, small individual",Corner Yoghurt,yogurt single,REDMERE FARMS WHITE POTATO 2.5KG,£1.29,1.29,(£0.52/kg),0.52,1.0,kg,0.52,kg,,,1,1
2016-10-19 13:10:01.116837,TESCO,211814,"Yoghurt, small individual",Corner Yoghurt,yogurt single,REDMERE FARMS CARROTS 1KG,£0.45,0.45,(£0.45/kg),0.45,1.0,kg,0.45,kg,,,1,1
2016-10-19 13:10:01.118898,TESCO,211814,"Yoghurt, small individual",Corner Yoghurt,yogurt single,TESCO BRITISH WHOLE MILK 2.272L/4 PINTS,£1.00,1.0,(£0.44/l),0.44,1.0,l,0.44,l,,,1,1
2016-10-19 13:10:01.120939,TESCO,211814,"Yoghurt, small individual",Corner Yoghurt,yogurt single,TESCO BROCCOLI 335G,£0.39,0.39,(£1.17/kg),1.17,1.0,kg,1.17,kg,,,1,1
2016-10-19 13:10:01.123028,TESCO,211814,"Yoghurt, small individual",Corner Yoghurt,yogurt single,TESCO BEEF LEAN STEAK MINCE 500G 5% FAT,£4.00,4.0,(£8.00/kg),8.0,1.0,kg,8.0,kg,,,1,1
2016-10-19 13:10:01.191626,TESCO,211814,"Yoghurt, small individual",Active & Cholesterol Lowering Yoghurt,yogurt single,DANONE ACTIVIA STRAWBERRY YOGHURT 4X125G,£2.00,2.0,(£0.40/100g),0.4,100,g,4.0,kg,All products available for this offer,Any 2 for £3.00,1,1
2016-10-19 13:10:01.194409,TESCO,211814,"Yoghurt, small individual",Active & Cholesterol Lowering Yoghurt,yogurt single,DANONE ACTIVIA RHUBARB YOGHURT 4X125G,£2.00,2.0,(£0.40/100g),0.4,100,g,4.0,kg,All products available for this offer,Any 2 for £3.00,1,1
2016-10-19 13:10:01.196532,TESCO,211814,"Yoghurt, small individual",Active & Cholesterol Lowering Yoghurt,yogurt single,DANONE ACTIVIA 0% FAT PEACH YOGHURT 4X125G,£2.00,2.0,(£0.40/100g),0.4,100,g,4.0,kg,All products available for this offer,Any 2 for £3.00,1,1
2016-10-19 13:10:01.198662,TESCO,211814,"Yoghurt, small individual",Active & Cholesterol Lowering Yoghurt,yogurt single,DANONE ACTIVIA 0% FAT CHERRY YOGHURT 4X125G,£2.00,2.0,(£0.40/100g),0.4,100,g,4.0,kg,All products available for this offer,Any 2 for £3.00,1,1
2016-10-19 13:10:01.200751,TESCO,211814,"Yoghurt, small individual",Active & Cholesterol Lowering Yoghurt,yogurt single,DANONE ACTIVIA 0% FAT RASPBERRY YOGHURT 4X125G,£2.00,2.0,(£0.40/100g),0.4,100,g,4.0,kg,All products available for this offer,Any 2 for £3.00,1,1
2016-10-19 13:10:01.202869,TESCO,211814,"Yoghurt, small individual",Active & Cholesterol Lowering Yoghurt,yogurt single,DANONE ACTIVIA 0% FAT VANILLA YOGHURT 4X125G,£2.00,2.0,(£0.40/100g),0.4,100,g,4.0,kg,All products available for this offer,Any 2 for £3.00,1,1
2016-10-19 13:10:01.205073,TESCO,211814,"Yoghurt, small individual",Active & Cholesterol Lowering Yoghurt,yogurt single,DANONE ACTIVIA INTENSELY CREAMY STRAWBERRY 4X11...,£2.40,2.4,(£0.55/100g),0.55,100,g,5.5,kg,All products available for this offer,Any 2 for £4.00,1,1
2016-10-19 13:10:01.207263,TESCO,211814,"Yoghurt, small individual",Active & Cholesterol Lowering Yoghurt,yogurt single,DANONE ACTIVIA INTENSELY CREAMY RASPBERRY 4X110...,£2.40,2.4,(£0.55/100g),0.55,100,g,5.5,kg,All products available for this offer,Any 2 for £4.00,1,1
2016-10-19 13:10:01.209365,TESCO,211814,"Yoghurt, small individual",Active & Cholesterol Lowering Yoghurt,yogurt single,DANONE ACTIVIA INTENSELY CREAMY PEACH YOGHURT 4...,£2.40,2.4,(£0.50/100g),0.5,100,g,5.0,kg,All products available for this offer,Any 2 for £4.00,1,1
2016-10-19 13:10:01.211526,TESCO,211814,"Yoghurt, small individual",Active & Cholesterol Lowering Yoghurt,yogurt single,DANONE ACTIVIA RED FRUITS YOGHURT 0% FAT 8X125G,£2.90,2.9,(£0.29/100g),0.29,100,g,2.9,kg,,,1,1
2016-10-19 13:10:01.213523,TESCO,211814,"Yoghurt, small individual",Active & Cholesterol Lowering Yoghurt,yogurt single,BENECOL STRAWBERRY YOGHURT DRINK 6X67.5G,£3.75,3.75,(£0.93/100g),0.93,100,g,9.3,kg,All products available for this offer,Any 2 for £6.00,1,1
2016-10-19 13:10:01.215780,TESCO,211814,"Yoghurt, small individual",Active & Cholesterol Lowering Yoghurt,yogurt single,DANONE ACTIVIA MIXED FRUIT YOGHURT 8X125G,£2.90,2.9,(£0.29/100g),0.29,100,g,2.9,kg,,,1,1
2016-10-19 13:10:01.217820,TESCO,211814,"Yoghurt, small individual",Active & Cholesterol Lowering Yoghurt,yogurt single,DANONE ACTIVIA FUSION BLUEBERRY ACAI YOGHURT 4X...,£2.20,2.2,(£0.44/100g),0.44,100,g,4.4,kg,All products available for this offer,Any 2 for £3.00,1,1
2016-10-19 13:10:01.219964,TESCO,211814,"Yoghurt, small individual",Active & Cholesterol Lowering Yoghurt,yogurt single,DANONE ACTIVIA FIG YOGHURT 4X125G,£2.00,2.0,(£0.40/100g),0.4,100,g,4.0,kg,All products available for this offer,Any 2 for £3.00,1,1
2016-10-19 13:10:01.222201,TESCO,211814,"Yoghurt, small individual",Active & Cholesterol Lowering Yoghurt,yogurt single,DANONE ACTIVIA BLUEBERRY YOGHURT 4X125G,£2.00,2.0,(£0.40/100g),0.4,100,g,4.0,kg,All products available for this offer,Any 2 for £3.00,1,1
2016-10-19 13:10:01.224302,TESCO,211814,"Yoghurt, small individual",Active & Cholesterol Lowering Yoghurt,yogurt single,DANONE ACTIVIA FUSIONS PRUNE YOGHURT 4X125G,£2.20,2.2,(£0.44/100g),0.44,100,g,4.4,kg,All products available for this offer,Any 2 for £3.00,1,1
2016-10-19 13:10:01.230975,TESCO,211814,"Yoghurt, small individual",Active & Cholesterol Lowering Yoghurt,yogurt single,ACTIVIA RASPBERRY AND PEACH YOGHURT 4X125G,£2.00,2.0,(£0.40/100g),0.4,100,g,4.0,kg,All products available for this offer,Any 2 for £3.00,1,1
2016-10-19 13:10:01.233085,TESCO,211814,"Yoghurt, small individual",Active & Cholesterol Lowering Yoghurt,yogurt single,BENECOL LIGHT NATURAL YOGHURT DRINK 6 X 67.5G,£3.75,3.75,(£0.93/100g),0.93,100,g,9.3,kg,All products available for this offer,Any 2 for £6.00,1,1
2016-10-19 13:10:01.235229,TESCO,211814,"Yoghurt, small individual",Active & Cholesterol Lowering Yoghurt,yogurt single,DANONE ACTIVIA INTENSELY CREAMY BLUEBERRY 4X110...,£2.40,2.4,(£0.55/100g),0.55,100,g,5.5,kg,All products available for this offer,Any 2 for £4.00,1,1
2016-10-19 13:10:01.237457,TESCO,211814,"Yoghurt, small individual",Active & Cholesterol Lowering Yoghurt,yogurt single,DANONE ACTIVIA HEALTH FRUITS YOGURTS 8X125G,£2.90,2.9,(£0.29/100g),0.29,100,g,2.9,kg,,,1,1
2016-10-19 13:10:01.239597,TESCO,211814,"Yoghurt, small individual",Active & Cholesterol Lowering Yoghurt,yogurt single,TESCO BRITISH SKIMMED MILK 2.272L/4 PINTS,£1.00,1.0,(£0.44/l),0.44,1.0,l,0.44,l,,,1,1
2016-10-19 13:10:01.242644,TESCO,211814,"Yoghurt, small individual",Active & Cholesterol Lowering Yoghurt,yogurt single,TESCO BRAEBURN APPLES LOOSE,£0.32,0.32,(£2.00/kg),2.0,1.0,kg,2.0,kg,,,1,1
2016-10-19 13:10:01.244664,TESCO,211814,"Yoghurt, small individual",Active & Cholesterol Lowering Yoghurt,yogurt single,TESCO GALA APPLES LOOSE,£0.32,0.32,(£2.00/kg),2.0,1.0,kg,2.0,kg,,,1,1
2016-10-19 13:10:01.246701,TESCO,211814,"Yoghurt, small individual",Active & Cholesterol Lowering Yoghurt,yogurt single,TESCO BRITISH SEMI SKIMMED MILK 2.272LTR 4 PINT...,£1.00,1.0,(£0.44/l),0.44,1.0,l,0.44,l,,,1,1
2016-10-19 13:10:01.248800,TESCO,211814,"Yoghurt, small individual",Active & Cholesterol Lowering Yoghurt,yogurt single,LOOSE BROWN ONIONS,£0.16,0.16,(£0.75/kg),0.75,1.0,kg,0.75,kg,,,1,1
2016-10-19 13:10:01.250925,TESCO,211814,"Yoghurt, small individual",Active & Cholesterol Lowering Yoghurt,yogurt single,TESCO CARROTS LOOSE,£0.06,0.06,(£0.60/kg),0.6,1.0,kg,0.6,kg,,,1,1
2016-10-19 13:10:01.260766,TESCO,211814,"Yoghurt, small individual",Fat Free & Low Fat Yoghurt,yogurt single,TESCO LOW FAT BERRY MEDLEY YOGHURT 6X125G,£1.00,1.0,(£0.13/100g),0.13,100,g,1.3,kg,,,1,1
2016-10-19 13:10:01.262893,TESCO,211814,"Yoghurt, small individual",Fat Free & Low Fat Yoghurt,yogurt single,TESCO LOW FAT NATURAL YOGHURT 500G,£0.90,0.9,(£0.18/100g),0.18,100,g,1.8,kg,,,1,1
2016-10-19 13:10:01.268116,TESCO,211814,"Yoghurt, small individual",Fat Free & Low Fat Yoghurt,yogurt single,MULLER LIGHT FRUITS YOGHURT 6X175G,£2.00,2.0,(£0.19/100g),0.19,100,g,1.9,kg,Save £1.00 Was £3.00 Now £2.00 - all products for this offer,Save £1.00 Was £3.00 Now £2.00,1,1
2016-10-19 13:10:01.270250,TESCO,211814,"Yoghurt, small individual",Fat Free & Low Fat Yoghurt,yogurt single,MULLER LIGHT TOFFEE YOGHURT 175G,£0.55,0.55,(£0.31/100g),0.31,100,g,3.1,kg,All products available for this offer,Any 10 for £3.00,1,1
2016-10-19 13:10:01.272449,TESCO,211814,"Yoghurt, small individual",Fat Free & Low Fat Yoghurt,yogurt single,DANONE ACTIVIA STRAWBERRY YOGHURT 4X125G,£2.00,2.0,(£0.40/100g),0.4,100,g,4.0,kg,All products available for this offer,Any 2 for £3.00,1,1
2016-10-19 13:10:01.274716,TESCO,211814,"Yoghurt, small individual",Fat Free & Low Fat Yoghurt,yogurt single,MULLER LIGHT STRAWBERRY YOGHURT 175G,£0.55,0.55,(£0.31/100g),0.31,100,g,3.1,kg,All products available for this offer,Any 10 for £3.00,1,1
2016-10-19 13:10:01.276802,TESCO,211814,"Yoghurt, small individual",Fat Free & Low Fat Yoghurt,yogurt single,MULLER LIGHT BANANA AND CUSTARD YOGHURT 175G,£0.55,0.55,(£0.31/100g),0.31,100,g,3.1,kg,All products available for this offer,Any 10 for £3.00,1,1
2016-10-19 13:10:01.279020,TESCO,211814,"Yoghurt, small individual",Fat Free & Low Fat Yoghurt,yogurt single,TESCO EVERYDAY VALUE LOW FAT FRUIT YOGHURT 4X12...,£0.35,0.35,(£0.07/100g),0.07,100,g,0.7,kg,,,1,1
2016-10-19 13:10:01.281051,TESCO,211814,"Yoghurt, small individual",Fat Free & Low Fat Yoghurt,yogurt single,SKI SMOOTH STRAWBERRY & RASPBERRY YOGHURT 4X120...,£1.00,1.0,(£0.21/100g),0.21,100,g,2.1,kg,,,1,1
